<?xml version="1.0" encoding="ISO-8859-1"?>
<!DOCTYPE game SYSTEM "config.dtd">
<game>
	<name>Word Challenge</name>
	<config>
		<starttime>210</starttime>
		<background>../Word Challenge/resources/images/background.png</background>
		<pointsNewLetters>100</pointsNewLetters>
		<matches>
			<match amount="3" points="20" bonusTime="0"/>
			<match amount="4" points="25" bonusTime="4"/>
			<match amount="5" points="50" bonusTime="7"/>
			<match amount="6" points="100" bonusTime="10"/>
		</matches>
		<languages>
			<language name="spanish" dictionary="../Word Challenge/resources/dic/spanish-words.dic" flag="../Word Challenge/resources/images/spanish.png" 
			sprite="../Word Challenge/resources/images/spanishlangns.png" selsprite="../Word Challenge/resources/images/spanishlang.png"/>
			<language name="english" dictionary="../Word Challenge/resources/dic/english-words.dic" flag="../Word Challenge/resources/images/english.png" 
			sprite="../Word Challenge/resources/images/englishlangns.png" selsprite="../Word Challenge/resources/images/englishlang.png"/>
			<language name="italian" dictionary="../Word Challenge/resources/dic/italian-words.dic" flag="../Word Challenge/resources/images/italian.png" 
			sprite="../Word Challenge/resources/images/italianlangns.png" selsprite="../Word Challenge/resources/images/italianlang.png"/>
		</languages>
	</config>
</game>
